<?xml version="1.0" encoding="UTF-8"?>
<!-- Generated by Fujitsu Interstage XWand B0251 -->
<link:linkbase xmlns:xsi="http://www.w3.org/2001/XMLSchema-instance" xsi:schemaLocation="http://www.xbrl.org/2003/linkbase http://www.xbrl.org/2003/xbrl-linkbase-2003-12-31.xsd" xmlns:sr="http://www.rgs.mef.gov.it/xbrl/accrual/ska/rend/2025-04-14" xmlns:link="http://www.xbrl.org/2003/linkbase" xmlns:xlink="http://www.w3.org/1999/xlink" xmlns:xbrli="http://www.xbrl.org/2003/instance">
  <link:roleRef roleURI="http://www.rgs.mef.gov.it/xbrl/accrual/ska/rend/2025-04-14/role/CalcVertSPPatrimoniale" xlink:type="simple" xlink:href="../accrual-ska-roles_2025-04-14.xsd#CalcVertSPPatrimoniale"/>
  <link:calculationLink xlink:type="extended" xlink:role="http://www.rgs.mef.gov.it/xbrl/accrual/ska/rend/2025-04-14/role/CalcVertSPPatrimoniale">
    <link:loc xlink:type="locator" xlink:href="../accrual-ska-roles_2025-04-14.xsd#sr_SP_AttivoTotale" xlink:label="SP_AttivoTotale" xlink:title="SP_AttivoTotale"/>
    <link:loc xlink:type="locator" xlink:href="../accrual-ska-roles_2025-04-14.xsd#sr_SP_AttivitaNonCorrentiTotale" xlink:label="SP_AttivitaNonCorrentiTotale" xlink:title="SP_AttivitaNonCorrentiTotale"/>
    <link:calculationArc xlink:type="arc" xlink:arcrole="http://www.xbrl.org/2003/arcrole/summation-item" xlink:from="SP_AttivoTotale" xlink:to="SP_AttivitaNonCorrentiTotale" xlink:title="calculation: SP_AttivoTotale to SP_AttivitaNonCorrentiTotale" order="1.0" weight="1.0"/>
    <link:loc xlink:type="locator" xlink:href="../accrual-ska-roles_2025-04-14.xsd#sr_SP_ATT-A-TOT" xlink:label="SP_ATT-A-TOT" xlink:title="SP_ATT-A-TOT"/>
    <link:calculationArc xlink:type="arc" xlink:arcrole="http://www.xbrl.org/2003/arcrole/summation-item" xlink:from="SP_AttivitaNonCorrentiTotale" xlink:to="SP_ATT-A-TOT" xlink:title="calculation: SP_AttivitaNonCorrentiTotale to SP_ATT-A-TOT" order="1.0" weight="1.0"/>
    <link:loc xlink:type="locator" xlink:href="../accrual-ska-roles_2025-04-14.xsd#sr_SP_ATT-A.1" xlink:label="SP_ATT-A.1" xlink:title="SP_ATT-A.1"/>
    <link:calculationArc xlink:type="arc" xlink:arcrole="http://www.xbrl.org/2003/arcrole/summation-item" xlink:from="SP_ATT-A-TOT" xlink:to="SP_ATT-A.1" xlink:title="calculation: SP_ATT-A-TOT to SP_ATT-A.1" order="1.0" weight="1.0"/>
    <link:loc xlink:type="locator" xlink:href="../accrual-ska-roles_2025-04-14.xsd#sr_SP_ATT-A.2" xlink:label="SP_ATT-A.2" xlink:title="SP_ATT-A.2"/>
    <link:calculationArc xlink:type="arc" xlink:arcrole="http://www.xbrl.org/2003/arcrole/summation-item" xlink:from="SP_ATT-A-TOT" xlink:to="SP_ATT-A.2" xlink:title="calculation: SP_ATT-A-TOT to SP_ATT-A.2" order="2.0" weight="1.0"/>
    <link:loc xlink:type="locator" xlink:href="../accrual-ska-roles_2025-04-14.xsd#sr_SP_ATT-A.3" xlink:label="SP_ATT-A.3" xlink:title="SP_ATT-A.3"/>
    <link:calculationArc xlink:type="arc" xlink:arcrole="http://www.xbrl.org/2003/arcrole/summation-item" xlink:from="SP_ATT-A-TOT" xlink:to="SP_ATT-A.3" xlink:title="calculation: SP_ATT-A-TOT to SP_ATT-A.3" order="3.0" weight="1.0"/>
    <link:loc xlink:type="locator" xlink:href="../accrual-ska-roles_2025-04-14.xsd#sr_SP_ATT-A.4" xlink:label="SP_ATT-A.4" xlink:title="SP_ATT-A.4"/>
    <link:calculationArc xlink:type="arc" xlink:arcrole="http://www.xbrl.org/2003/arcrole/summation-item" xlink:from="SP_ATT-A-TOT" xlink:to="SP_ATT-A.4" xlink:title="calculation: SP_ATT-A-TOT to SP_ATT-A.4" order="4.0" weight="1.0"/>
    <link:loc xlink:type="locator" xlink:href="../accrual-ska-roles_2025-04-14.xsd#sr_SP_ATT-A.5" xlink:label="SP_ATT-A.5" xlink:title="SP_ATT-A.5"/>
    <link:calculationArc xlink:type="arc" xlink:arcrole="http://www.xbrl.org/2003/arcrole/summation-item" xlink:from="SP_ATT-A-TOT" xlink:to="SP_ATT-A.5" xlink:title="calculation: SP_ATT-A-TOT to SP_ATT-A.5" order="5.0" weight="1.0"/>
    <link:loc xlink:type="locator" xlink:href="../accrual-ska-roles_2025-04-14.xsd#sr_SP_ATT-A.6" xlink:label="SP_ATT-A.6" xlink:title="SP_ATT-A.6"/>
    <link:calculationArc xlink:type="arc" xlink:arcrole="http://www.xbrl.org/2003/arcrole/summation-item" xlink:from="SP_ATT-A-TOT" xlink:to="SP_ATT-A.6" xlink:title="calculation: SP_ATT-A-TOT to SP_ATT-A.6" order="6.0" weight="1.0"/>
    <link:loc xlink:type="locator" xlink:href="../accrual-ska-roles_2025-04-14.xsd#sr_SP_ATT-B-TOT" xlink:label="SP_ATT-B-TOT" xlink:title="SP_ATT-B-TOT"/>
    <link:calculationArc xlink:type="arc" xlink:arcrole="http://www.xbrl.org/2003/arcrole/summation-item" xlink:from="SP_AttivitaNonCorrentiTotale" xlink:to="SP_ATT-B-TOT" xlink:title="calculation: SP_AttivitaNonCorrentiTotale to SP_ATT-B-TOT" order="2.0" weight="1.0"/>
    <link:loc xlink:type="locator" xlink:href="../accrual-ska-roles_2025-04-14.xsd#sr_SP_ATT-B.1" xlink:label="SP_ATT-B.1" xlink:title="SP_ATT-B.1"/>
    <link:calculationArc xlink:type="arc" xlink:arcrole="http://www.xbrl.org/2003/arcrole/summation-item" xlink:from="SP_ATT-B-TOT" xlink:to="SP_ATT-B.1" xlink:title="calculation: SP_ATT-B-TOT to SP_ATT-B.1" order="1.0" weight="1.0"/>
    <link:loc xlink:type="locator" xlink:href="../accrual-ska-roles_2025-04-14.xsd#sr_SP_ATT-B.1.1" xlink:label="SP_ATT-B.1.1" xlink:title="SP_ATT-B.1.1"/>
    <link:calculationArc xlink:type="arc" xlink:arcrole="http://www.xbrl.org/2003/arcrole/summation-item" xlink:from="SP_ATT-B.1" xlink:to="SP_ATT-B.1.1" xlink:title="calculation: SP_ATT-B.1 to SP_ATT-B.1.1" order="1.0" weight="1.0"/>
    <link:loc xlink:type="locator" xlink:href="../accrual-ska-roles_2025-04-14.xsd#sr_SP_ATT-B.1.2" xlink:label="SP_ATT-B.1.2" xlink:title="SP_ATT-B.1.2"/>
    <link:calculationArc xlink:type="arc" xlink:arcrole="http://www.xbrl.org/2003/arcrole/summation-item" xlink:from="SP_ATT-B.1" xlink:to="SP_ATT-B.1.2" xlink:title="calculation: SP_ATT-B.1 to SP_ATT-B.1.2" order="2.0" weight="1.0"/>
    <link:loc xlink:type="locator" xlink:href="../accrual-ska-roles_2025-04-14.xsd#sr_SP_ATT-B.1.3" xlink:label="SP_ATT-B.1.3" xlink:title="SP_ATT-B.1.3"/>
    <link:calculationArc xlink:type="arc" xlink:arcrole="http://www.xbrl.org/2003/arcrole/summation-item" xlink:from="SP_ATT-B.1" xlink:to="SP_ATT-B.1.3" xlink:title="calculation: SP_ATT-B.1 to SP_ATT-B.1.3" order="3.0" weight="1.0"/>
    <link:loc xlink:type="locator" xlink:href="../accrual-ska-roles_2025-04-14.xsd#sr_SP_ATT-B.1.4" xlink:label="SP_ATT-B.1.4" xlink:title="SP_ATT-B.1.4"/>
    <link:calculationArc xlink:type="arc" xlink:arcrole="http://www.xbrl.org/2003/arcrole/summation-item" xlink:from="SP_ATT-B.1" xlink:to="SP_ATT-B.1.4" xlink:title="calculation: SP_ATT-B.1 to SP_ATT-B.1.4" order="4.0" weight="1.0"/>
    <link:loc xlink:type="locator" xlink:href="../accrual-ska-roles_2025-04-14.xsd#sr_SP_ATT-B.1.5" xlink:label="SP_ATT-B.1.5" xlink:title="SP_ATT-B.1.5"/>
    <link:calculationArc xlink:type="arc" xlink:arcrole="http://www.xbrl.org/2003/arcrole/summation-item" xlink:from="SP_ATT-B.1" xlink:to="SP_ATT-B.1.5" xlink:title="calculation: SP_ATT-B.1 to SP_ATT-B.1.5" order="5.0" weight="1.0"/>
    <link:loc xlink:type="locator" xlink:href="../accrual-ska-roles_2025-04-14.xsd#sr_SP_ATT-B.1.6" xlink:label="SP_ATT-B.1.6" xlink:title="SP_ATT-B.1.6"/>
    <link:calculationArc xlink:type="arc" xlink:arcrole="http://www.xbrl.org/2003/arcrole/summation-item" xlink:from="SP_ATT-B.1" xlink:to="SP_ATT-B.1.6" xlink:title="calculation: SP_ATT-B.1 to SP_ATT-B.1.6" order="6.0" weight="1.0"/>
    <link:loc xlink:type="locator" xlink:href="../accrual-ska-roles_2025-04-14.xsd#sr_SP_ATT-B.1.7" xlink:label="SP_ATT-B.1.7" xlink:title="SP_ATT-B.1.7"/>
    <link:calculationArc xlink:type="arc" xlink:arcrole="http://www.xbrl.org/2003/arcrole/summation-item" xlink:from="SP_ATT-B.1" xlink:to="SP_ATT-B.1.7" xlink:title="calculation: SP_ATT-B.1 to SP_ATT-B.1.7" order="7.0" weight="1.0"/>
    <link:loc xlink:type="locator" xlink:href="../accrual-ska-roles_2025-04-14.xsd#sr_SP_ATT-B.1.8" xlink:label="SP_ATT-B.1.8" xlink:title="SP_ATT-B.1.8"/>
    <link:calculationArc xlink:type="arc" xlink:arcrole="http://www.xbrl.org/2003/arcrole/summation-item" xlink:from="SP_ATT-B.1" xlink:to="SP_ATT-B.1.8" xlink:title="calculation: SP_ATT-B.1 to SP_ATT-B.1.8" order="8.0" weight="1.0"/>
    <link:loc xlink:type="locator" xlink:href="../accrual-ska-roles_2025-04-14.xsd#sr_SP_ATT-B.1.9" xlink:label="SP_ATT-B.1.9" xlink:title="SP_ATT-B.1.9"/>
    <link:calculationArc xlink:type="arc" xlink:arcrole="http://www.xbrl.org/2003/arcrole/summation-item" xlink:from="SP_ATT-B.1" xlink:to="SP_ATT-B.1.9" xlink:title="calculation: SP_ATT-B.1 to SP_ATT-B.1.9" order="9.0" weight="1.0"/>
    <link:loc xlink:type="locator" xlink:href="../accrual-ska-roles_2025-04-14.xsd#sr_SP_ATT-B.1.10" xlink:label="SP_ATT-B.1.10" xlink:title="SP_ATT-B.1.10"/>
    <link:calculationArc xlink:type="arc" xlink:arcrole="http://www.xbrl.org/2003/arcrole/summation-item" xlink:from="SP_ATT-B.1" xlink:to="SP_ATT-B.1.10" xlink:title="calculation: SP_ATT-B.1 to SP_ATT-B.1.10" order="10.0" weight="1.0"/>
    <link:loc xlink:type="locator" xlink:href="../accrual-ska-roles_2025-04-14.xsd#sr_SP_ATT-B.1.11" xlink:label="SP_ATT-B.1.11" xlink:title="SP_ATT-B.1.11"/>
    <link:calculationArc xlink:type="arc" xlink:arcrole="http://www.xbrl.org/2003/arcrole/summation-item" xlink:from="SP_ATT-B.1" xlink:to="SP_ATT-B.1.11" xlink:title="calculation: SP_ATT-B.1 to SP_ATT-B.1.11" order="11.0" weight="1.0"/>
    <link:loc xlink:type="locator" xlink:href="../accrual-ska-roles_2025-04-14.xsd#sr_SP_ATT-B.1.12" xlink:label="SP_ATT-B.1.12" xlink:title="SP_ATT-B.1.12"/>
    <link:calculationArc xlink:type="arc" xlink:arcrole="http://www.xbrl.org/2003/arcrole/summation-item" xlink:from="SP_ATT-B.1" xlink:to="SP_ATT-B.1.12" xlink:title="calculation: SP_ATT-B.1 to SP_ATT-B.1.12" order="12.0" weight="1.0"/>
    <link:loc xlink:type="locator" xlink:href="../accrual-ska-roles_2025-04-14.xsd#sr_SP_ATT-B.2" xlink:label="SP_ATT-B.2" xlink:title="SP_ATT-B.2"/>